Match,Match-href,Home,Away,Score,Date/Time,element
"Match page >","http://opta.mc.cloud.opta.net/sportscentre/index.html?page=match&mc=RugbyProPortal&season=2018&competition=243&match=23178","Zebre","Pau","33 - 38","KO: 21 Oct 2017 14:00","PauMinutes PlayedTacklesMissed TacklesTurnovers Won1. Geoffrey Moise 544002. Lucas Rey 404203. Lourens Adriaanse 474104. Fabrice Metz 805005. Masalosalo Tutaia 403106. Ben Mowen 405227. Paddy Butler 8011018. Peter Saili 626119. Clovis Lebail 5650010. Brandon Fajardo 5630011. Watisoni Votu 8022012. Jale Vatubua 8013013. Florian Nicot 8040014. Frank Halai 8020115. Charly Malie 8010016. Laurent Bouchet 4040017. Jamie Mackintosh 2610018. Sylvain Charlet 3300019. Daniel Ramsay 4000020. Pierrick Gunther 4010021. Lekima Tagitagivalu 1821022. Thibault Daubagna 2420123. Tom Taylor 24100"
"Match page >","http://opta.mc.cloud.opta.net/sportscentre/index.html?page=match&mc=RugbyProPortal&season=2018&competition=243&match=23183","Krasny Yar","Edinburgh","14 - 73","KO: 21 Oct 2017 10:00","EdinburghMinutes PlayedTacklesMissed TacklesTurnovers Won1. Darryl Marfo401002. Neil Cochrane6313113. WP Nel403204. Anton Bresler8011215. Grant Gilchrist508006. Lewis Carmichael805317. Luke Crosbie8011108. Cornell Du Preez5411009. Sam Hidalgo-Clyne5440110. Jason Tovey2450011. Tom Brown8030012. Solomoni Rasolea5442013. James Johnstone8090114. Damien Hoyland8071115. Blair Kinghorn8062016. Stuart McInally1750017. Murray McCallum4021118. Simon Berghan4050019. Fraser McKenzie3060020. Viliame Mata2650121. Nathan Fowles5611022. Glenn Bryce2620023. Chris Dean26610"
"Match page >","http://opta.mc.cloud.opta.net/sportscentre/index.html?page=match&mc=RugbyProPortal&season=2018&competition=243&match=23165","Cardiff Blues","Lyon","29 - 19","KO: 13 Oct 2017 19:00","LyonMinutes PlayedTacklesMissed TacklesTurnovers Won1. Tornike Mataradze 614002. Deon Fourie 463113. Richard Choirat 205004. Etienne Oosthuizen 746215. Francois van der Merwe 615006. Tanginoa Halaifonua 809207. Theophile Cotte 8017118. Virgile Bruni 809109. Baptiste Couilloud 8050010. Piero Dominguez 6273111. Jone Tuva 8041212. Adrien Seguret 71111013. Pierre-Louis Barassi 80141114. Timilai Rokoduru 7120115. Delon Armitage 3310016. Virgile Lacombe 3420017. Hamza Kaabeche 1902018. Guram Papidze 6062019. Josh Bekhuis 1901020. Felix Lambey 000021. Theo Belan 910022. Jean-Marcellin Buttin 4711023. Jonathan Pelissie 18300"
"Match page >","http://opta.mc.cloud.opta.net/sportscentre/index.html?page=match&mc=RugbyProPortal&season=2018&competition=243&match=23169","Newcastle","Dragons","32 - 27","KO: 14 Oct 2017 15:00","DragonsMinutes PlayedTacklesMissed TacklesTurnovers Won1. Luke Garrett525002. Liam Belcher529323. Lloyd Fairbrother527004. Joseph Davies7611415. Matthew Screech276106. Aaron Wainwright8015707. Ollie Griffiths8013118. James Benjamin8010219. Sarel Pretorius8052010. Angus O'Brien8020011. George Gasson8061012. Adam Warren8091013. Jared Rosser80123114. Ashton Hewitt5723015. Will Talbot-Davies8041116. Gerard Ellis2830017. Thomas Davies2820018. Brok Harris2840019. Rynard Landman5370020. James Thomas420021. Owain Leonard000022. Gavin Henson000023. Pat Howard23410"
"Match page >","http://opta.mc.cloud.opta.net/sportscentre/index.html?page=match&mc=RugbyProPortal&season=2018&competition=243&match=23180","Bordeaux Begles","Newcastle","20 - 21","KO: 21 Oct 2017 17:30","NewcastleMinutes PlayedTacklesMissed TacklesTurnovers Won1. Rob Vickers777102. Scott Lawson8013103. Jon Welsh737004. Calum Green8013245. Sean Robinson8010416. Will Welch8010107. Gary Graham5211208. Ryan Burrows809129. Sam Stuart5611010. Toby Flood80112111. Adam Radwan8011012. Josh Matavesi8090113. Maxime Mermoz8031114. Chris Harris8031015. Alex Tait7010016. Ben Sowrey000017. Sami Mavinga310018. Scott Wilson710019. Glen Young000020. Mark Wilson2830021. Micky Young2441022. Cameron Cowell000023. Craig Willis0000"
"Match page >","http://opta.mc.cloud.opta.net/sportscentre/index.html?page=match&mc=RugbyProPortal&season=2018&competition=243&match=23175","Brive","Oyonnax","38 - 13","KO: 20 Oct 2017 18:00","OyonnaxMinutes PlayedTacklesMissed TacklesTurnovers Won1. Khatchik Vartanov 7421112. Hikawera Elliot 466003. Kevin Buys 409104. Manuel Leindeker 659005. Christian Njewel 537016. Luc Barba 408007. Shay Kerry 8015008. Maurie Fa'asavalu 7416209. Julien Audy 5120010. Anthony Fuertes 8021011. Axel Muler 8030112. Roimata Hansell-Pune 5130013. Ulupano Seuteni 8041014. Daniel Ikpefan 8041015. Silvere Tian 8040016. Benjamin Geledan 4030017. Giorgi Vepkhvadze 600018. Pietro Ceccarelli 4000019. Geoffrey Fabbri 2740020. James Hall 2910021. Jose Lima 2921022. Bilel Taieb 4020023. Kilian Bendjaballah 15000"
"Match page >","http://opta.mc.cloud.opta.net/sportscentre/index.html?page=match&mc=RugbyProPortal&season=2018&competition=243&match=23167","Sale","Toulouse","20 - 20","KO: 13 Oct 2017 20:00","ToulouseMinutes PlayedTacklesMissed TacklesTurnovers Won1. Danie Mienie 545012. Julien Marchand 470113. Maks van Dyk 668004. Florian Verhaeghe 809105. Piula Faasalele 766006. Semi Kunatani 8011237. Rynhard Elstadt 546008. François Cros 689009. Sebastien Bezy 8060110. Jean-Marc Doussain 80112011. Yoann Huget 3901012. Sofiane Guitoune 7851013. Jarrod Poi 8071114. Wandie Mjekevu 8012015. Maxime Medard 8031016. David Roumieu 3341017. Rodrigue Neti 2620018. Clement Castets 1430019. Gillian Galan 2630020. Carl Axtens 420021. Selevasio Tolofua 1220022. Romain Ntamack 4101023. Lucas Tauzin 2000"
"Match page >","http://opta.mc.cloud.opta.net/sportscentre/index.html?page=match&mc=RugbyProPortal&season=2018&competition=243&match=23170","London Irish","Edinburgh","14 - 37","KO: 14 Oct 2017 15:00","EdinburghMinutes PlayedTacklesMissed TacklesTurnovers Won1. Allan Dell484002. Stuart McInally6111003. Simon Berghan515004. Fraser McKenzie5710005. Ben Toolis8017006. Jamie Ritchie809207. John Hardie6612118. Cornell Du Preez807109. Sam Hidalgo-Clyne8050010. Jason Tovey73112011. Damien Hoyland6621012. Solomoni Rasolea7960013. Chris Dean8081014. Dougie Fife8040015. Glenn Bryce8000016. Neil Cochrane1930117. Darryl Marfo3222018. WP Nel2950019. Grant Gilchrist2341020. Luke Crosbie1400021. Nathan Fowles700022. Tom Brown100023. Jason Harries14200"
"Match page >","http://opta.mc.cloud.opta.net/sportscentre/index.html?page=match&mc=RugbyProPortal&season=2018&competition=243&match=23168","RC Enisei","Bordeaux Begles","17 - 57","KO: 13 Oct 2017 09:00","Bordeaux BeglesMinutes PlayedTacklesMissed TacklesTurnovers Won1. Thierry Paiva8018012. Ole Avei526013. Peni Ravai323004. Johan Aliouat6312205. Cyril Cazeaux8018206. Alexandre Roumat8014007. Hugh Chalmers5213128. Marco Tauleigne8014109. Gauthier Doubrere4770010. Matthieu Jalibert58110111. Iban Etcheverry8052012. Jean-Baptiste Dubie80171113. Pablo Uberti80132014. Metuisela Talebula8030015. Darly Domvo6821116. Florian Dufour2800017. Jean-Baptiste Poux2661018. Lasha Tabidze2220019. Pierre Gayraud1710020. Cameron Woki2860021. Kitione Kamikamica1210122. Yann Lesgourgues3300023. Tiaan Schoeman22200"
"Match page >","http://opta.mc.cloud.opta.net/sportscentre/index.html?page=match&mc=RugbyProPortal&season=2018&competition=243&match=23173","Krasny Yar","Stade Francais","34 - 29","KO: 14 Oct 2017 09:00","Stade FrancaisMinutes PlayedTacklesMissed TacklesTurnovers Won1. Zurabi Zhvania 4011002. Craig Burden 4610113. Giorgi Melikidze 4015204. Steevy Cerqueira 137005. Mathieu De Giovanni 8029106. Charlie Francoz 8014117. Sylvain Nicolas 7015118. Bakary Meite 8011519. Terry Bouhraoua 6080010. Shane Geraghty 8081011. Jimmy Yobo 8031012. Paul Williams 6051013. Theo Millet 8062014. Julien Arias 8042015. Tony Ensor 8011016. Lucas Da Silva 2210017. Elias El Ansari 4000018. Lorenzo Cittadini 4050019. Hugh Pyle 6772020. Maxime Gau 1220121. Arthur Coville 2030022. Jules Plisson 2000023. Karim Qadiri 10000"
"Match page >","http://opta.mc.cloud.opta.net/sportscentre/index.html?page=match&mc=RugbyProPortal&season=2018&competition=243&match=23172","Oyonnax","Connacht","15 - 43","KO: 14 Oct 2017 19:00","ConnachtMinutes PlayedTacklesMissed TacklesTurnovers Won1. Denis Coulson 7515202. Tom McCartney 6412003. Finlay Bealham 755104. Ultan Dillane 6412005. James Cannon 8017116. Eoghan Masterson 8011107. Eoin McKeon 8012008. John Muldoon 6911019. Caolin Blade 8021010. Andrew Deegan 8032011. Matt Healy 8020012. Thomas Farrell 8063013. Eoin Griffin 8070014. Cian Kelleher 6840015. Darragh Leader 8020016. Shane Delahunt 1651017. Peter McCabe 500018. Conor Carey 500019. Quinn Roux 1680020. James Connolly 1120021. Kieran Marmion 000022. Craig Ronaldson 040023. Rory Scholes 12100"
"Match page >","http://opta.mc.cloud.opta.net/sportscentre/index.html?page=match&mc=RugbyProPortal&season=2018&competition=243&match=23164","Pau","Gloucester","27 - 21","KO: 12 Oct 2017 19:45","GloucesterMinutes PlayedTacklesMissed TacklesTurnovers Won1. Paddy McAllister449102. Motu Matu'u443003. Josh Hohneck616004. Tom Savage7618015. Tom Denton286106. Jake Polledri784107. Jacob Rowan8014118. Freddie Clarke8015019. Callum Braley5151010. Owen Williams8053011. David Halaifonua8051212. Mark Atkinson80101113. Billy Twelvetrees74112114. Henry Purdy8071015. Tom Hudson4920016. James Hanson3980017. Val Rapava Ruskin2260118. Gareth Denman3960019. Ruan Ackermann5550020. Lewis Ludlow1200021. Ben Vellacott3210022. Billy Burns3400023. Henry Trinder9000"
"Match page >","http://opta.mc.cloud.opta.net/sportscentre/index.html?page=match&mc=RugbyProPortal&season=2018&competition=243&match=23176","Lyon","Sale","27 - 24","KO: 20 Oct 2017 18:30","SaleMinutes PlayedTacklesMissed TacklesTurnovers Won1. Ross Harrison 8012212. Rob Webber 6515113. Will John 687014. Bryn Evans 8013105. Andrei Ostrikov 7621216. Cameron Neild 6711217. Ben Curry 8017208. Sam Moore 6515019. Faf de Klerk 8032010. James O'Connor 80143011. Josh Charnley 8042012. Mark Jennings 8071013. Sam James 8022014. Denny Solomona 8051015. Mike Haley 8051016. Marc Jones 1550017. James Flynn 000018. Alexandru Tarus 1200019. George Nott 400020. Laurence Pearce 1510021. David Seymour 1310022. Will Cliff 000023. Arron Reed 0000"
"Match page >","http://opta.mc.cloud.opta.net/sportscentre/index.html?page=match&mc=RugbyProPortal&season=2018&competition=243&match=23177","Toulouse","Cardiff Blues","15 - 17","KO: 20 Oct 2017 20:00","Cardiff BluesMinutes PlayedTacklesMissed TacklesTurnovers Won1. Corey Domachowski 4713302. Kristian Dacey 6215003. Taufa'ao Filise 405204. James Down 8017305. Damian Welch 476406. Macauley Cook 809007. Josh Navidi 8010218. Nick Williams 565319. Tomos Williams 8042010. Jarrod Evans 80123111. Blaine Scully 8020012. Garyn Smith 75101013. Rey Lee-Lo 6572014. Alex Cuthbert 7034015. Matthew Morgan 6230116. Ethan Lewis 1820017. Bradley Thyer 3361018. Dillon Lewis 4020019. Seb Davies 3370120. Olly Robinson 2421021. Lloyd Williams 000022. Steve Shingler 511023. Willis Halaholo 24301"
"Match page >","http://opta.mc.cloud.opta.net/sportscentre/index.html?page=match&mc=RugbyProPortal&season=2018&competition=243&match=23179","Connacht","Worcester","15 - 8","KO: 21 Oct 2017 15:00","WorcesterMinutes PlayedTacklesMissed TacklesTurnovers Won1. Ethan Waller 646212. Jack Singleton 6912103. Gareth Milasinovich 547204. Pierce Phillips 6414105. Will Spencer 8023116. David Denton 8016127. Alafoti Fa'osiliva 8020428. Gerrit-Jan van Velze 5411209. Jonny Arr 5961010. Jono Lance 80121011. Josh Adams 8061212. Jackson Willison 80160113. Wynand Olivier 80123114. Tom Howe 5830015. Chris Pennell 8051016. Matt Williams 1120117. Ryan Bower 1660018. Simon Kerrod 2630119. Donncha O'Callaghan 1631020. Huw Taylor 2680021. Michael Dowsett 2112022. Sam Olver 000023. Perry Humphreys 22000"
"Match page >","http://opta.mc.cloud.opta.net/sportscentre/index.html?page=match&mc=RugbyProPortal&season=2018&competition=243&match=23171","Worcester","Brive","30 - 20","KO: 14 Oct 2017 15:00","BriveMinutes PlayedTacklesMissed TacklesTurnovers Won1. Vivien Devisme 4710102. Thomas Acquier 474003. Soso Bekoshvili 475104. Jan Uys 8010105. Sisa Koyamaibole 554216. Said Hireche 806117. Peniami Narisia 8011018. Retief Marais 587109. Vasil Lobzhanidze 8092010. Matthieu Ugalde 55121111. Nadir Megdoud 8051012. Benjamin Petre 4102213. Felix Le Bourhis 6561014. Benito Masilevu 8042015. Guillaume Namy 8040016. Mike Tadjer 3320017. Julien Brugnaut 3331018. Damien Jourdain 3311019. James Johnston 2500020. Louis Martin 1210021. Florian Cazenave 2520022. Arnaud Mignardi 3942023. Franck Romanet 15000"
"Match page >","http://opta.mc.cloud.opta.net/sportscentre/index.html?page=match&mc=RugbyProPortal&season=2018&competition=243&match=23182","RC Enisei","Dragons","21 - 28","KO: 21 Oct 2017 13:00","DragonsMinutes PlayedTacklesMissed TacklesTurnovers Won1. Luke Garrett 452102. Elliott Dee 489103. Leon Brown 485004. Joseph Davies 8014105. Cory Hill 571206. Aaron Wainwright 8021207. Ollie Griffiths 245008. James Benjamin 8011009. Sarel Pretorius 5641110. Angus O'Brien 5642011. George Gasson 8020012. Pat Howard 8070313. Tyler Morgan 80102114. Jared Rosser 8061115. Hallam Amos 8020016. Gerard Ellis 3241017. Thomas Davies 3571018. Lloyd Fairbrother 3280019. Rynard Landman 2360020. James Thomas 56120021. Charlie Davies 2400022. Gavin Henson 2421023. Adam Warren 0000"
"Match page >","http://opta.mc.cloud.opta.net/sportscentre/index.html?page=match&mc=RugbyProPortal&season=2018&competition=243&match=23181","Stade Francais","London Irish","7 - 44","KO: 21 Oct 2017 19:45","London IrishMinutes PlayedTacklesMissed TacklesTurnovers Won1. Harry Elrington 5313102. Tom Woolstencroft 7011223. Oli Hoskins 6412004. William Lloyd 7016015. Filo Paulo 8019116. Max Northcote-Green 7011107. Conor Gilsenan 8022208. Lasha Lomidze 7420219. Ben Meehan 4530010. Theo Brophy Clews 77161011. Topsy Ojo 8001012. Johnny Williams 61140113. Tom Fowlie 80120014. Joe Cokanasiga 8093015. Ben Ransom 8040016. Todd Gleave 1020017. Tom Smallbone 2751018. Lovejoy Chawatama 1620019. Joshua McNally 1010020. Isaac Curtis-Harris 1690121. Scott Steele 2510022. Jacob Atkins 320023. Fergus Mulchrone 19401"
"Match page >","http://opta.mc.cloud.opta.net/sportscentre/index.html?page=match&mc=RugbyProPortal&season=2018&competition=243&match=23174","Gloucester","Agen","61 - 16","KO: 19 Oct 2017 19:45","AgenMinutes PlayedTacklesMissed TacklesTurnovers Won1. Meddih Ahaouche 7211002. Clement Martinez 6510003. Kamaliele Tufele 657304. Christiaan van der Merwe 808005. Corentin Braendlin 806106. Jessy Jegerlhener 538207. Yoan Tanga 809008. Leo Ghirard 547309. Hugo Verdu 6742010. Jeremy Russell 8080011. Branden Holder 8072112. Ryan Dubois 5644113. Alban Conduche 8081114. Lucas Tolot 4242115. Loris Tolot 8010016. Jordan Peyri 1510117. Oliver Butler 000018. Corentin Chabeaudie 2421019. Cedric Touchkaieff 2721020. Pierre Fouyssac 3160021. Florian Lanave 1330022. Clement Farah 800023. Valentin Saurs 38220"
"Match page >","http://opta.mc.cloud.opta.net/sportscentre/index.html?page=match&mc=RugbyProPortal&season=2018&competition=243&match=23166","Agen","Zebre","45 - 10","KO: 13 Oct 2017 19:00","ZebreMinutes PlayedTacklesMissed TacklesTurnovers Won1. Andrea De Marchi 8013412. Luhandre Luus 807103. Eduardo Bello 547014. Leonard Krumov 407105. Valerio Bernabo 8011016. Jacopo Sarto 8011007. Johan Meyer 716008. Derick Minnie 403029. Guglielmo Palazzani 7192110. Serafin Bordoli 6965111. Giovanbattista Venditti 8022012. Faialaga Afamasaga 80120013. Matteo Pratichetti 4034014. Gabriele Di Giulio 8050015. Ciaran Gaffney 6130116. Oliviero Fabiani 000017. Andrea Lovotti 000018. Roberto Tenga 26101019. David Sisi 4090020. Giovanni Licata 4061021. Marcello Violi 000022. Maicol Azzolini 3111023. Tommaso Boni 40801"
